Francais,Nufi
J'ai écouté ça à la radio,Ngɑ̌ yú' yāā mɑ̀ ntám mbǔ'nkèn.
Où est ta mère/maman?,Mɑ̄ é mɑ̀ hɑ̄?
Elle est sortie.,Ǎ tóm. Ǎ tə́b.
"Désolé, je t'ai menti, elle est à la maison.","Lɑ̀hsì ā lɑ́, ngɑ̌ fʉ̀ɑ̀ ō, ǎ mbèè(ǎ ndʉ́ɑ́)."
Que fait-il/elle?,Ǎ mɑ̀ngʉ́ kɑ́? Kɑ́ tɑ́ ǎ mɑ̀ngʉ́ ʉ̄?
"Elle fait la cuisine, elle prépare à manger.",Ǎ mɑ̀ndə̄ə̄ wúzɑ̄.
Où est ton père/papa?,Mbɑ̄' é mɑ̀ hɑ̄?
Il regarde la télé.,Ǎ mɑ̀njīī mbǔ'nkěn-yīīsì.
Je lui ai dit que tu es venu(il y a peu de temps) chercher ma grande sœur.,Ngɑ̌ lén mbú í mɑ́ ó fhʉ̄nsɑ́' ncāk ngà'mbhǐ à yì mʉ̀nzhwīē.
Tu es malade? Pourquoi lui as-tu dit?,Ǒ mɑ̀ngóó ú? Ǒ sók í nǔkɑ́?
Je lui ai dit parce qu'il m'a demandé.,Ngɑ̌ sók ī mbī'tū mɑ́ á tə̀'sì ā.
Qui a mangé ma nourriture?,Wɑ̄ bɑ̄ nzɑ̄ wúzɑ̄ ā?
C'est la souris qui a mangé ta nourriture.,Cwǎkhù bɑ̄ nzɑ̄ wúzɑ̄ ō.
Qui t'a frappé/tapé/battu?,Wɑ̄ bɑ̄ nzàb ō?
C'est maman qui m'a frappé.,Mɑ̄vǒ bɑ̄ nzàb ā.
Qui te taquine?,Wɑ̄ bɑ́ mɑ̀nkám ō?
C'est Mbūānì qui me taquine.,Mbūànì bɑ́ mɑ̀nkám ā.
Qui fait du bruit? Qui bavarde?,Wɑ̄ bɑ́ mɑ̀njwáásí ī?
C'est Sīēwèn qui bavarde.,Sīèwèn bɑ́ mɑ̀njwáásí.
Qui pleure?,Wɑ̄ bɑ́ mɑ̀ngé' ē?
C'est Monthe.,Mòōntʉ̀ɑ̀' bɑ́.
Est-ce que tu t'es lavé?,Ǒ sǒh nā ō ó? Tɑ̀ ǒ sǒh nā ò?
"Non, je ne me suis pas encore lavé.","Ngǎ', ǹ njǎt sì sǒh nā à(bɑ̄)."
"Oui, je me suis déjà lavé.",Ŋ̄h! Ngɑ̌ yá' sǒh nā à.
Est-ce que tu t'es lavé les mains ?,Ǒ sǒh mbō mō ó? Tɑ̀ ǒ sǒh mbō mō ò?
"Oui, je me suis lavé les mains.","Ŋ̄h, ngɑ̌ sǒh mbō ma᷅."
As-tu mangé? Est-ce que tu as mangé?,Ǒ zɑ́ wúzɑ̄ ɑ́? Tɑ̀ ǒ zɑ́ wū ù?
"Oui, j'ai mangé.","Ŋ̄h, ngɑ̌ zɑ́ wū/wúzɑ̄."
"Non, je n'ai rien mangé.","Ngǎ', ǹ kɑ̀' zɑ̄ sə̀ə̄wū(bɑ̄)."
As-tu écouté la nouvelle?,Ǒ yú' cə̀' ə́? Ǒ yú' cwè' é? Tɑ̀ ǒ yú' cə̀'/cwè'?
"Non, je n'ai pas écouté la nouvelle.","Ngǎ', ǹ kɑ̀' yū' cə̀'/cwè'(bɑ̄)."
Qu'est-ce que tu fais comme ça?,Kɑ́ tɑ́ ó mɑ̀ngʉ́ fà'á ā? Ǒ mɑ̀ngʉ́ kɑ́ fà'á ā?
Qu'est-ce que j'ai fait?,Ngɑ̌ ghʉ̌ kɑ́? Ngɑ̌ ghʉ̀ lāhā?
Qu'as-tu fait comme ça?,Kɑ́ tɑ́ ó ghʉ̀ fà'á ā? Ǒ ghʉ̌ kɑ́ fà'á ā?
Tu as déjà vu quoi?,Ǒ yá' yīī kɑ́? Ǒ yá' tɑ̄ njīī kɑ́?
Qu'est-ce que c'est?,Kɑ́ bɑ́ ɑ̄?
C'est un rat.,Mbɑ̀ɑ̄ndòm bɑ́.
Qu'est-ce que c'est que ceci/ça?,Kɑ́ béè?
C'est une abeille.,Ŋwɑ̄' bɑ́.
Quelle heure est-il?,Nàm sʉ̄' béè?
Il est 14h.,Nàm pʉ́ɑ́ mbūànzɑ̄ béè(2:00 MBZ).
Combien y a-t-il?,Yáá sʉ̄'ʉ̄? Yáá mvàk lāhā?
Il y en a quatre.,Yáá kwɑ̀.
Combien sont-ils?,Pó pʉ̀ sʉ̄'ʉ̄?
Ils sont nombreux.,Pó tɑ̀ njə̄ə̄.
Chapitre 5. Relations familiales.,Nzâknù 5. Nkhʉ̌těndʉ̄ɑ̄.
"La famille est la racine vitale de l'humanité. À la fin de ce chapitre, vous serez en mesure de citer tous les membres de la famille en langue fè'éfě'è.",Těndʉ́ɑ́ mbɑ̄ mɑ́ ngǎ'vɑ̌h nzhwìàwènòk! Ǒ ìndī' měh béé sìèsì lè mɑ̀ ǒ còh nzhī zén nkwèè pʉ̌ těndʉ̄ɑ̄ ò mɑ̀ ghə̀ə̄ fè'éfě'è.
La famille.,Těndʉ̄ɑ̄.
Ma famille.,Těndʉ̄ɑ̄ à.
Comment va ta famille?,Těndʉ̄ɑ̄ ó mɑ̀ lāhā?
Ma famille se porte bien.,Těndʉ̄ɑ̄ á ntèn.
Ma famille ne se porte pas bien.,Těndʉ̄ɑ̄ ā sī ntèn bɑ̄.
Le père.,Mbɑ̄'.
Mon père.,Mbɑ̄' ō [Mbō'ō]/Táàwɑ̄.
La mère.,Mɑ̄.
Ma mère.,Mɑ̄vǒ/ Mɑ̂ wɑ̄/Mɑ̄ ō [Mō ō].
Ta mère.,Mɑ̄ ē [Mēē].
Ton père.,Mbɑ̄' ē [Mbē'ē]/ Táà wē.
Sa mère.,Mɑ̄ ā [Mɑ̄ɑ̄].
Son père.,Mbɑ̄' ā [Mbɑ̄' ɑ̄]/ Táà wā.
Notre mère.,Mɑ̄ ā yòh.
Notre père.,"Mbɑ̄'(à) yòh, Mbɑ̂' yòh."
Votre mère.,Mɑ̄ à yèè.
Votre père.,"Mbɑ̄'(à) yèè, Mbɑ̂' yèè."
Leur mère.,Mɑ̄ ā yɑ̀ɑ̀.
Leur père.,"Mbɑ̄'(à) yɑ̀ɑ̀, Mbɑ̂' yɑ̀ɑ̀."
Les parents.,Mbɑ̄' pí mɑ̄. Pɑ̀mbɑ̄'.
Mes parents.,Mbɑ̄' ō pí mɑ̄vǒ. Pɑ̀ mbɑ̄' zǎ.
Tes grands-parents sont encore vivants?,Mbɑ̄' ē pí mɑ̄ ē ndāmɑ̌ nját wū ú?
Mes grands-parents ne sont plus vivants.,Mbɑ̄' ō pí mɑ̄vǒ ndāmɑ̀ sǐ' nját wū bɑ̄.
L'enfant.,Mōō/Mēn.
Mon enfant.,Mēn à.
Les enfants.,"Pōō, pʉ̄nkhʉ̄ɑ̄."
Mes enfants sont très intelligents.,Pōō mbǎ nzhīnù tɑ̀'.
Tes enfants sont très têtus.,Pōō mbǒ ncə́ə́/nshwītū/nténtū tɑ̀'.
Ses enfants sont très chiches.,Pōō mbǐ ngʉ̄ɑ̄' tɑ̀'.
Mon premier-né.,Túfì ā.
Mon premier-né est très bête.,Túfì á nkíkén tɑ̀'.
Ton premier-né est déjà marié?,Túfì ó yá' lə̄ə̄ndʉ̄ɑ̄ ɑ́?
Son premier-né est décédé aujourd'hui.,Túfì í kúɑ́(cák lò kīkēē) zě'è.
Dernier-né.,Ncát mōō.
Je suis le dernier-né.,Ngɑ̌ mɑ́ ncát mōō.
Il/elle est mon dernier-né.,Ǎ mɑ́ ncát mēn à.
Mon dernier-né est très paresseux.,Ncát mēn ǎ ndē' tɑ̀'.
Je suis enfant unique.,Ngɑ̌ mɑ́ nshwìè mōō.
Les petits-enfants.,Póópōō. Pōō yòk pʉ́ɑ́.
Les jumeaux.,Póónì. Ngʉ̀ɑ̀'ndʉ̄ɑ̄.
La mère des jumeaux.,Mɑ̂nì. Ndʉ̀mbʉ́ɑ́.
Le père des jumeaux.,Táànì/Tέɛ̀nì. Mbàtndʉ̄ɑ̄.
"Le frère, la sœur.",Mēmmɑ̄.
"Mon frère, Ma sœur.",Mēmmɑ̄ ò.
Un homme.,Mbâ'.
Une femme.,Mʉ̀nzhwīē.
Mon frère.,Mēmmɑ̄ ò yì mbâ'.
Ma sœur.,Mēmmɑ̄ ò yì mʉ̀nzhwīē.
Les frères et sœurs.,Póómɑ̄. Mfátmfāt.
Mes frères et sœurs.,Póómɑ̄ ō.
"Le grand-frère, la grande-sœur.",Ngà'mbhì.
"Mon grand-frère, ma grande-sœur.",Ngà'mbhǐ à.
"Le petit-frère, la petite-sœur.",Ngà'njàm.
"Mon petit-frère, Ma petite-sœur.",Ngà'njǎm à.
Le grand père.,Mbɑ̄'ndāmɑ̀/Mbɑ̄'ndābɑ̀.
Mon grand-père.,Mbɑ̄' ō ndāmɑ̀.
"La grand-mère, la mamie.",Mɑ̄ndāmɑ̀/Mɑ̄ndābɑ̀.
Ma grand-mère.,Mɑ̄vǒ ndāmɑ̀.
Où vivent tes parents?,Mbɑ̄' ē pí mɑ̄ é nsī mɑ̀ hɑ̄?
Où habitent-ils(quand c'est la 2ème fois qu'on pose la question)?,Pó nsī mɑ̀ hɑ̄ lī?
Que fait ta mère comme métier?,Mɑ̄ é ngʉ́ kɑ́? Mɑ̄ é mfɑ́' kɑ́? Kɑ́ tɑ́ mɑ̄ é mfɑ́' ɑ̄?
Que fait ton père comme métier?,Mbɑ̄' é ngʉ́ kɑ́? Mbɑ̄' é mfɑ́' kɑ́? Kɑ́ tɑ́ mbɑ̄' é mfɑ́' ɑ̄?
Que font tes parents?,Mbɑ̄' ē pí mɑ̄ é ngʉ́/mfɑ́' kɑ́?
"Le mari, l'époux.",Ndū.
Mon mari.,Ndū à.
"La femme, l'épouse.","Nzhwīē, ntòònjò'."
"Ma femme, mon épouse.","Nzhwīē à, ntòònjò' à."
Ma femme s'appelle Noumbissie.,Zén nzhwīē á mɑ́ Nǔmbísīē.
Ma femme est stérile.,Nzhwīē á mɑ́ ncēn mʉ̀nzhwīē.
Mon mari s'appelle Siebatcheu.,Zén ndū á mɑ́ Sīēbɑ́ncə̄ə̄.
Mon mari est stérile.,Ndū á mɑ́ ncìncēn mbâ'.
Mon mari ne m'aime plus.,Ndū ā sǐ' nját nkwé' ā bɑ̄.
Coépouse.,Fɑ̄h/fə̄h. Fɑ́hnkhʉ̄ɑ̄/fə́hnkhʉ̄ɑ̄.
Ma coépouse.,"Fɑ́h à, fə́h à."
As-tu des enfants?,Ǒ ghʉ̌ pōō ú? Ǒ ghʉ̌ pʉ̄nkhʉ̄ɑ̄ ɑ́?
J'ai un enfant.,Ngɑ̌ ghʉ̌ tɑ̀' mōō.
Mon enfant a sept ans.,Mēn ǎ ghʉ̌ ngǔ'nzɑ̄ sə̀ə̀mbʉ́ɑ́.
Il/elle s'appelle Nakmanou.,Zēn zǐ mɑ́ Nàkmɑ̀nù.
"Non, je n'ai pas d'enfants.","Ngǎ', ǹ kɑ̀' ghʉ́ pōō(bɑ̄)."
Je n'ai aucun enfant.,Ǹ kɑ̀' ghʉ́ sə̀ə̄ mōō(bɑ̄).
"Oui, j'ai seulement six enfants.",Ŋ̄h! Ngɑ̌ ghʉ̌ ndɑ̌' pōō ntòhō.
As-tu des petits-enfants?,Ǒ ghʉ̌ pōō yòk pʉ́ɑ́ ɑ́?
Où habite ton père?,Mbɑ̄' é nsī mɑ̀ hɑ̄?
Son père a de l'argent?,Mbɑ̄' á ghʉ̌ nkɑ̄ɑ̄ ɑ́?
Quel âge a ta mère?,Mɑ̄ é ghʉ̌ ngǔ'nzɑ̄ sʉ̄' ʉ̄?
Quel âge a ton fils?,Mēn ò yì mbá' ghʉ̌ ngǔ'nzɑ̄ sʉ̄' ʉ̄?
Sa fille est très intelligente.,Mēn ì yì mʉ̀nzhwíé nzhīnù tɑ̀'.
Ses enfants sont très stupides/bêtes.,Pōō mbǐ nkíkén tɑ̀'.
"Je ne suis pas idiot, je suis intelligent.","Ǹ sī mɑ́ nkìnkèn bɑ̄, ngɑ̌ mɑ́ tɑ̀' nzhînù."
"Une bêtise, une sottise, une idiotie.","Kìkēn, kìkénù."
Tes enfants aiment-ils l'école?,Pōō mbǒ nkwé' nǔ ŋwɑ̀'nì í?
Ton frère ou ta sœur est déjà marié?,Mēmmɑ̄ ě yá' lə̄ə̄ndʉ̄ɑ̄ ɑ́?
Ton frère est encore célibataire?,Mēmmɑ̄ è yì mbâ' yǎt mɑ́ nshwìèmbâ' á?
Sa sœur est très belle.,Mēmmɑ̄ à yì mʉ̀nzhwíé pě'ngòò tɑ̀'.
Ses frères et sœurs sont plus intelligents que lui.,Póómɑ̄ á nzhīnù nshʉ́ɑ́ ī.
Ton grand-frère vit avec vous?,Ngà'mbhǐ ò yì mbá' nsī pí pěn?
Sa grande-sœur était morte.,Ngà'mbhǐ ì yì mʉ̀nzhwīē lɑ̀kúɑ́.
J'aime tellement ta petite-sœur.,Ngɑ̌ nkwé' ngà'njǎm ò yì mʉ̀nzhwīē tɑ̀'.
Je déteste tellement son petit-frère.,Ngɑ̌ mbéé ngà'njǎm ì yì mbâ' tɑ̀ mbʉ́ɑ́ lɑ̀ bɑ̄.
Ton grand-père vit-il encore?,Mbɑ̄' ē ndāmɑ̌ nját wū ú? Mbɑ̄' ē ndāmɑ̀ yǎt wū ú?
"Oui, mon grand-père est encore vivant.","Ŋ̄h, mbɑ̄' ō ndāmɑ̌ nját wū."
Tu es chanceux.,Mbhì bɑ́ wò. Zīī zǒ léé.
Sa grand-mère n'est plus vivante.,Mɑ̄ ā [Mɑ̄ ɑ̄] ndāmɑ̀ sǐ' nját wū bɑ̄.
"Mes condoléances, mon frère, ma sœur.",Cə̄ə̄ ngwāh mēmmɑ̄ ò.
Est-ce que ton mari t'aime?,Ndū ó nkwé' ō ó?
Bien sûr! C'est quel genre de question ça?,Ŋ̄h bɑ̂! Yàā ntīē(Kɑ́ ntīē) tè'sínù báá ā?
Son mari ne l'aime pas du tout.,Ndū ī sǐ' nkwé' ī mbɑ̀ nèhē bɑ̄.
Ah bon? Vraiment?,Fà'á á? Ndéndēē é?
Ta femme est très gentille.,Nzhwīē ó ghʉ̌ mbè'nthʉ̄ tɑ̀ kēēmbʉ̄ɑ̄.
Sa femme est très stricte.,Nzhwīē í ncōh tɑ̀'.
"J'aime tellement ma coépouse, mais elle me déteste.","Ngɑ̌ nkwé' fɑ́h à tɑ̀', tɑ́', à mɑ̄mbéé nā."
Sa coépouse cherche trop des problèmes.,Fɑ́h í ncāk nù tɑ̀'.
Elle bagarre avec sa coépouse.,Yɑ̄ɑ̄ pí fɑ́h í mɑ̀ntʉ̄ɑ̄' nkwàà. Ǎ mɑ̀ntʉ̄ɑ̄' nkwàà pí fɑ́h ì.
Ma coépouse et moi avons résolu nos problèmes.,Yōh pí fɑ́h á nìɑ̄ [nìɑ̀ɑ̀sǐ] ncà' yōh.
Es-tu célibataire?,Ǒ mɑ́ nshwìè wěn?
"Oui, je suis célibataire.","Ŋ̄h, ngɑ̌ mɑ́ nshwìèwèn."
Je suis femme célibataire.,Ngɑ̌ mɑ́ nshwìè mʉ̀nzhwīē.
Il est célibataire.,Ǎ mɑ́ nshwìè mbâ'.
Je suis dans une relation amoureuse.,Wěn nɑ́ à.
Je suis fiancée.,Pó ghù ā. Pó kɑ̀' ā lə́ə́ndʉ̄ɑ̄.
Je suis déjà fiancée.,Pó yá' ghù ā.
La dot.,Ghù.
Je suis marié.,Ngɑ̌ lə́ə́ndʉ̄ɑ̄.
Je suis déjà marié.,Ngɑ̌ yá' lə̄ə̄ndʉ̄ɑ̄.
Je n'ai pas trouvé de mari.,Ǹ kɑ̀' yīī ndū. Ngɑ̌ cǎm ndʉ̄ɑ̄.
Je suis divorcé(e).,Ngɑ̌ tóm lə́ə́ndʉ̄ɑ̄.
Je suis séparé de ma femme.,Yōh pí nzhwīē á sèèsì/ghɑ̀ɑ̀sì.
Je suis séparée de mon mari.,Yōh pí ndū á sèèsì/ghɑ̀ɑ̀sì.
Je suis stérile.,Ngɑ̌ mɑ́ ncên wèn. Ngɑ̌ mɑ́ ncìncên wèn.
Je suis un polygame.,Ngɑ̌ mɑ́ ngà'kə̀ə̄pʉ̌nzhwīē.
La polygamie.,Nǔkə̀ə̄pʉ̌nzhwīē.
La monogamie.,Nǔmʉ̀nzhwīēnshʉ̀'.
Je suis veuf.,Ngɑ̌ mɑ́ fɑ̄h mbâ'.
Je suis veuve.,Ngɑ̌ mɑ́ fɑ̄h mʉ̀nzhwīē.
Chapitre 6. Relations familiales(2).,Nzâknù 6. Nkhʉ̌těndʉ̄ɑ̄(2).
"La famille est la racine vitale de l'humanité. À la fin de ce chapitre, vous serez en mesure de citer tous les membres de la famille en langue fè'éfě'è.",Těndʉ́ɑ́ mbɑ̄ mɑ́ ngǎ'vɑ̌h nzhwìàwènòk! Ǒ ìndī' měh béé sìèsì lè mɑ̀ ǒ còh nzhī zén nkwèè pʉ̌ těndʉ̄ɑ̄ ò mɑ̀ ghə̀ə̄ fè'éfě'è.
L'oncle maternel.,Mbɑ̂' wèn njàm mɑ̄. Mēmmɑ̄ mɑ̄ yì mbâ'.
L'oncle paternel.,Mbɑ̂' wèn njàm mbɑ̄'. Mēmmɑ̄ mbɑ̄' yì mbâ'.
Le petit-fils.,Mênmēn(yì mbâ'). Mēn yòk pʉ́ɑ́(yì mbâ').
C'est ma petite-fille.,Mênmēn à(yì mʉ̀nzhwīē) bɑ́. Mēn à yòk pʉ́ɑ́(yì mʉ̀nzhwīē) bɑ́.
Où habite ton petit-fils?,Mênmēn ǒ(ò yì mbá') nsī mɑ̀ hɑ̄? Mēn ò yòk pʉ́ɑ́(yì mbá') nsī mɑ̀ hɑ̄?
La tante maternelle.,Mɑ̄ à wèn njàm mɑ̄. Mēmmɑ̄ mɑ̄ yì mʉ̀nzhwīē.
La tante paternelle.,Mɑ̄ à wèn njàm mbɑ̄'. Mēmmɑ̄ mbɑ̄' yì mʉ̀nzhwīē.
"Le cousin, la cousine.",Mēmmɑ̄.
Mon neveu.,Mēn à yì mbâ'.
Ma nièce.,Mēn à yì mʉ̀nzhwīē.
Beau-frère.,Ndômnsì.
Mon beau-frère est venu.,Ndômnsì á sɑ̀'.
Ma belle-sœur. [C'est l'épouse qui parle],"Mɑ̂nsì, ndū, mēndū."
Ma belle-sœur est malade. [C'est l'époux qui parle],"Mɑ̂nsǐ ǎ mɑ̀ngóó, nzhwīē á mɑ̀ngóó."
Beau-père de la femme.,"Mbɑ̂'ndū, ndū ndāmɑ̀."
Mon Beau-père m'aime beaucoup. [L'épouse parle],Mbɑ̂'ndū á nkwé' ā tɑ̀ shʉ̄ɑ̀. Ndū ā ndāmɑ̌ nkə́' ā tɑ̀ mbʉ́ɑ́ lɑ̀ bɑ̄.
Son beau-père lui a donné une portion de terrain. [On parle d'un homme],Mbɑ̂'nzhwīē í(Ndômsǐ í) hɑ̄ sípè'é mbú í.
Ta belle-mère est veuve? [On pose la question à une femme].,Mɑ̄lū(Mɑ̄ndū) ó mɑ́ fɑ̂h mʉ̀nzhwīē é?
Ma belle-mère est morte. [L'époux parle],"Ngām ǎ cák lò kīkēē, mɑ̄shwī' á kūɑ̄."
"Ma bru, ma belle-fille entretient bien mon fils.",Nzhwīèmēn ǎ ncāp mēn à pə̀pē'.
"Gendre, beau-fils. [Appellation par la mère de la mariée].",Ndū.
"Gendre, beau-fils. [Appellation par le père de la mariée].",Nsì/ndômnsì.
"Frères ou sœurs, cousins, cousines, bref toute la famille de l'époux; beau-frère, belle-sœur.","Nsì, mēndū."
"Chapitre 7. Emplois, profession, métier.",Nzâknù 7. Túmfɑ̀'.
"Travaille aujourd'hui et mange demain, paresse aujourd'hui et vole demain. À la fin de ce chapitre, vous serez en mesure de citer plusieurs métiers en langue fè'éfě'è.","Fɑ̀' zě'è, ndīē wāhà nzɑ̄, lē' zě'è ndīē wāhà nzhʉ́ɑ́! Ǒ ìndī' měh béé sìèsì lè, mɑ̀ ǒ còh nzhī nzén ntīēntíé mfɑ̀' mɑ̀ ghə̀ə̄ fè'éfě'è."
Quelle est ta profession?,Yò túmfɑ̌' mɑ́ kɑ́?
Où travailles-tu?,Ǒ mfɑ́' mɑ̀ hɑ̄?
Pour qui travailles-tu?,Ǒ mfɑ́' mbí wɑ̄? Ǒ mfɑ́' nɑ́ pó wɑ̄?
Que fais-tu comme travail? Quel genre de travail fais-tu?,Yàā ntīē mfɑ̀' tɑ́ ó mfɑ́' ɑ̄?
Qu'est-ce que tu fais dans la vie?,Kɑ́ tɑ́ ó ngʉ́ ʉ̄/mfɑ́' ɑ̄? Yò túmfɑ̌' mɑ́ kɑ́?
Je suis étudiant(e).,Ngɑ̌ mɑ́ ngà'ŋwɑ̀'nì.
Je suis enseignant(e)/professeur(e).,Ngɑ̌ mɑ́ nsìèsì.
"Un précepteur(enseignant à domicile), répétiteur.",Nsìèsǐndʉ̄ɑ̄.
Je suis un chômeur.,Ngɑ̌ mɑ́ mvɑ̂hnèhē.
Je cherche du travail/emploi.,Ngɑ̌ mɑ̀ncāk mfɑ̀'.
La recherche d'emploi est très pénible.,Làh ncāk mfɑ̌' ghɑ̀' tɑ̀'.
Je suis femme au foyer.,Ngɑ̌ mɑ́ nzhwīèndʉ̄ɑ̄.
Je suis chercheur.,Ngɑ̌ mɑ́ ncâkngà'.
Je suis médecin.,Ngɑ̌ mɑ́ ngà'kà'/mfɑ̀'kà'. Ngɑ̌ mɑ́ ncwènghòò.
Infirmier/infirmière.,"Mōòkà', ncwènghòò/ndhìghòò, mfɑ̀'kà'."
Informatique.,Zhínǔsāhndó'.
Je suis informaticien.,Ngɑ̌ mɑ́ ncâkngǎ' nɑ́ zhínǔsāhndó'.
"Le salaire, la rémunération.","Có'mfɑ̀', nkɑ̄ɑ̀mfɑ̀'."
Es-tu bien payé?,Pó ncóh ncō' mfɑ̀' mō ó?
Je ne suis pas bien rémunéré.,Pō sǐ' ncóh ncō' mfɑ̀' mā bɑ̄.
Ma femme est bien rétribuée.,Pó ncóh ncō' mfɑ̌' nzhwīē à.
Payer les heures supplémentaires.,Ncō' shwì'ndɑ̀h.
Faire des heures supplémentaires.,Mfɑ́' shwì'ndɑ̀h.
Je suis artiste/ingénieur.,Ngɑ̌ mɑ́ ngà'vʉ̀.
Je suis un ingénieur en informatique.,Ngɑ̌ mɑ́ ngà'vʉ̌ nɑ́ zhínǔsāhndó'.
Que fait ta mère comme métier?,Mɑ̄ é mfɑ́' kɑ́? Kɑ́ tɑ́ mɑ̄ é mfɑ́' ɑ̄?
Ma mère est ingénieur en informatique.,Mɑ̄vǒ mɑ́ ngà'vʉ̌ nɑ́ zhínǔsāhndó'.
Je suis un(une) agriculteur(trice).,Ngɑ̌ mɑ́ tɑ̀' nzʉ̂'nʉ̀ɑ̀.
Je suis un avocat.,Ngɑ̌ mɑ́ tɑ̀' nkôntā'.
Combien d'heures par jour travailles-tu?,Ǒ mfɑ́' nàm sʉ̄'ʉ́ nɑ́ líé'nzɑ̄ ɑ̄?
Je travaille seulement cinq heures par jour.,Ngɑ̌ mfɑ́' ndɑ̌' nàm tíí nɑ́ líé'nzɑ̄.
Combien de fois par semaine travailles-tu?,Ǒ mfɑ́' ncām sʉ̄'ʉ́ nɑ́ ngɑ̀ɑ̄nzɑ̄ ɑ̄?
Je travaille six jours par semaine.,Ngɑ̌ mfɑ́' līē' ntòhó nɑ́ ngɑ̀ɑ̄nzɑ̄.
Je travaille même les weekends.,Ngɑ̌ mfɑ́' mbɑ̌ nɑ́ mèhngɑ̀ɑ̀.
Le patron.,Mbɑ̂'mfɑ̀'.
Mon patron est très strict.,Mbɑ̂'mfɑ̀' mǎ ncōh tɑ̀'.
Qui est ton employeur?,Wɑ̄ bɑ́ mbɑ̂'mfɑ̀' mō? Wɑ̄ bɑ́ yò mbɑ̂'mfɑ̀'?
J'ai été licencié(e).,Pó yòk á mfɑ̀'. Pó tēh á mfɑ̀'.
Ma patronne est très gentille.,Mɑ̄àmfɑ̀' mǎ ghʉ̌ mbè' nthʉ̄.
On a augmenté mon salaire.,Pó shwǐ' có'mfɑ̀' mǎ.
Mon père est un bourreau de travail.,Mbɑ̄' ó mɑ́ tɑ̀' mfɑ̀'ndīēkò.
Je suis journaliste.,Ngɑ̌ mɑ́ nsìènkèn.
Je suis chanteur.,Ngɑ̌ mɑ́ njɔ̀nshì.
Mon premier-né est un(e) danseur(se).,Túfì á mɑ́ tɑ̀' nzênshì.
"M. Djoumbissie était un instrumentiste(guitariste, harpiste) exceptionnel.",Mbɑ̄' Njòómbísīē lɑ̌' mɑ́ tɑ̀' tômfʉ̀' mbû'lōk.
Je suis un comptable.,Ngɑ̌ mɑ́ nsâhzū/nsâhnkɑ̄ɑ̄.
Je suis un officier de banque.,Ngɑ̌ mɑ́ ngà'mfɑ̌' ndʉ̄ɑ̀nkɑ̄ɑ̄.
Je travaille avec des handicapés.,Ngɑ̌ mfɑ́' nɑ́ pɑ̀nkɑ̀yɑ̀'/nkɑ̀zhʉ̀ɑ̀'.
Je travaille pour des personnes âgées et les handicapés.,Ngɑ̌ mfɑ́' nɑ́ mvěn pʉ̀ píá nkɑ̀zhʉ̀ɑ̀'.
Mon dernier-né est couturier/couturière.,Ncát mēn ǎ mɑ́ ntâmndhī.
Mon ami est coiffeur.,Sēn ǎ mɑ́ nkōòtū.
Mon patron est très paresseux.,Mbɑ̂'mfɑ̀' mǎ ndē' tɑ̀'.
Il accable les gens de travail.,Ǎ ndáh mfɑ̀' nzhī pʉ̀.
Je ne travaille pas en ce moment.,Ǹ sī mɑ̀mfɑ́' ntìé' bɑ̄.
Je reste à la maison et m'occupe des enfants.,Ngɑ̌ nsī mbèè mɑ̄mfɑ́' nɑ́ pʉ̄nkhʉ̄ɑ̄.
Je suis à la retraite.,Ngɑ̌ ténɑ́ mfɑ̀'.
J'ai pris une pause; j'ai pris congé.,Ngɑ̌ lǎh hwīēsì.
Je suis en vacances.,Ngɑ̌ mɑ̀ hwīēsì.
Je fais du volontariat/bénévolat.,Ngɑ̌ mfɑ́' pě'nthʉ̄.
"Une usine; originellement, une forge.",Lə̀ə̀.
Usine de fabrication de véhicules.,Lə̀ə̄ ndʉ̄'.
Je suis un chef d'entreprise.,Ngɑ̌ mɑ́ tɑ̀' nsɑ̂'lə̀ə̀. Ngɑ̌ mɑ́ tɑ̀' nsɑ̂'mfɑ̀'.
Un forgeron.,Nthîlə̀ə̀.
Chef/directeur d'usine.,"Táàlə̀ə̀, nsɑ̂'lə̀ə̀."
J'ai ma propre entreprise.,Ngɑ̌ ghʉ̌ tɑ̀' lə̀ə̀.
Mon fils est Chirurgien.,Mēn ǎ mɑ́ tɑ̀' nsēèwèn.
Je suis/travaille à mon compte.,Ngɑ̌ mfɑ́' ndǒk à.(Litt. Je travaille seul).
Cordonnier.,Nnìɑ̀ncāt.
Je suis balayeur(yeuse).,Ngɑ̌ mɑ́ njòhzʉ̀'.
J'ai épousé un éboueur.,Ngɑ̌ lə́ə́ tɑ̀' ngwɑ̂'mbī'/ngwɑ̂'ghǎ'zū.
Son père est un grand cuisinier.,Mbɑ̄' á mɑ́ tɑ̀' ghɑ̀' ndə̄ə̀càk/nnâ'càk.
J'ai un restaurant.,Ngɑ̌ ghʉ̌ tɑ̀' ndʉ̄ɑ̀wúzɑ̄.
Je suis un politicien.,Ngɑ̌ mɑ́ ngà'ngèè.
Je suis commerçant.,Ngɑ̌ mɑ́ ntâ'ntēē.
Je suis agent immobilier.,Ngɑ̌ mɑ́ tɑ̀' ngà'nzhǐ nɑ́ nǔ pè'è.
Je suis agent secret.,Ngɑ̌ mɑ́ tɑ̀' nnɑ̂'wèn.
Son petit-frère est un clown.,Ngà'njǎm ǐ mɑ́ ngà'ncàhsì/mmɑ̀'kwà'.
Homme de ménage/boy.,"Sǒmndʉ̄ɑ̄/sə̌bndʉ̄ɑ̄, mēnkhʉ̄ɑ̄/mʉ̄nkhʉ̄ɑ̄."
Je suis animateur télé.,Ngɑ̌ mɑ́ mmɑ̀'kwǎ' ntám mbǔ'nkěn-yīīsì.
Je suis bagagiste.,Ngɑ̌ mɑ́ nŋɑ̂'pʉ̀ɑ̀.
Je suis bibliothécaire.,Ngɑ̌ mɑ́ ngà'mfɑ̌'ntǎ'ŋwɑ̀'nì.
Je suis bijoutier.,Ngɑ̌ mɑ́ nnìɑ̀zū/nthîzū.
Je suis boulanger.,Ngɑ̌ mɑ́ nnìɑ̀tòòtōm.
Je suis caméraman/photographe.,Ngɑ̌ mɑ́ ndàhnìnì.
Je suis charcutier.,Ngɑ̌ mɑ́ mfèn ngʉ̄nə̀ə̀/ngwàà ngʉ̄nə̀ə̀.
Je suis chercheur en nouvelles technologies de l'information et de la communication.,Ngɑ̌ mɑ́ tɑ̀' ncâkngǎ' nɑ́ zúvʉ̀ fī.
Je suis en formation de guitariste.,Ngɑ̌ mɑ̀nzhī'sī làh mbɑ̄ mbû'lōk.
Je suis en stage.,Ngɑ̌ mɑ̀ngʉ́ tēhsípō/tēhsítū.
Je suis stagiaire en médecine.,Ngɑ̌ mɑ̀ngʉ́ tēhsípó/tēhsítú nɑ́ mfɑ̌'kà'.
Je suis peintre en bâtiment.,Ngɑ̌ mɑ́ nsî'pè'è.
Je suis réparateur(trice) de télévision/réparateur(trice)-télé.,Ngɑ̌ mɑ́ tɑ̀' nnìɑ̀ɑ̀ mbǔ'nkěn-yīīsì/mbǔ'nkěn-yēēsì.
Je suis stagiaire en électricité.,Ngɑ̌ mɑ̀ngʉ́ tēhsípó/tēhsítú nɑ́ mfɑ̌'mōh.
Je suis un barman.,Ngɑ̌ mɑ́ mfèndù'.
Je suis un boucher.,Ngɑ̌ mɑ́ mfènmbɑ̀ɑ̀/ngwààmbɑ̀ɑ̀.
Je suis un décorateur.,Ngɑ̌ mɑ́ nkēèzū.
Je suis ingénieur en génie mécanique.,Ngɑ̌ mɑ́ ngà'vʉ̌ nɑ́ zhínǔthítēnɑ̄.
Je suis un mécanicien automobile.,Ngɑ̌ mɑ́ tɑ̀' nnìɑ̀ndʉ̄'.
On m'a licencié(e) il y a neuf mois.,Pō lɑ̀yǒk/lɑ̀téh á mfɑ̀' yáá yá' ghʉ̌ ŋúnzɑ̄ vʉ̀'ʉ̄.
"Titulaire d'un doctorat, PhD(Dr).",Nshʉ̀ɑ̀yɑ́'ncâkngà'/shʉ̀ɑ̀ncāk(Shck).
Un centre d'appels.,Ndʉ̄ɑ̀ pɑ᷅'nkèn/ca᷅hnkèn.
Un dentiste.,Tɑ̀' ncwènsè'/ncwènsə̀'. Tɑ̀' ngà'kǎ'nsə̀'.
Un écrivain.,"Tɑ̀' ntìèŋwɑ̀'nì, tɑ̀' ngà'tìè."
Un/une secrétaire.,"Ndò'càm, ntìècàm, ntìèghə̀ə̀, ndàhghə̀ə̀."
Un électricien.,Ngà'mfɑ̌'mōh.
"Un éleveur, une éleveuse.",Nnâknə̀ə̀.
Un expert.,Nshʉ̀ɑ̀yɑ́' nzhînù/Nshʉ̀ɑ̀yɑ́' ncâkngà'.
Un facteur.,Ngɑ̀ɑ̀ŋwɑ̀'nì.
Un fleuriste.,Ngà'mfɑ̌'nsə̀ə̀.
Un gardien de nuit.,Mbīɑ̀zʉ̀' sū'/thʉ̄'.
Un juge.,"Ncwēèncà', nsɑ̂'ncà', ndɑ̀'ncà'."
Un livreur.,Ngɑ̀ɑ̀pū'.
Un maçon.,"Nkwâtpè'è, mbōòpè'è."
Un maître d'hôtel.,Nsɑ̂'ndʉ̄ɑ̀ngèn.
Un marin.,"Ngà'mfɑ̌'ndʉ̂'nshì, ngà'mfɑ̌'nshì."
Un menuisier.,Nkōònthʉ̄.
Un musicien.,"Mbû'nshì, nnìɑ̀nshì, mbû'lōk. Cf. Njɔ̀nshì : chanteur, singer."
Un pêcheur.,Ndù'mbìè/ngòòmbɑ̀ɑ̄nshì.
Un policier.,Nŋwâtlɑ̄'.
Un militaire.,"Mɑ̄njə̀'/mɑ̄njwè', ndʉ̄ɑ̀'ncò."
Un soldat.,Ndʉ̄ɑ̀'ngāā/ndʉ̄ɑ̀'ncò.
Un portier.,Mbīɑ̀ndʉ̄ɑ̄.
Un potier.,Mbōòcàk.
Un secouriste.,"Nzhììsì, mbʉ̂'wèn."
Un tailleur.,Ntâmndhī.
Un vétérinaire.,Ngà'kǎ'nə̀ə̀.
Un/une kinésithérapeute.,Nsèn-wèn.
Un/une manucure(personne exerçant de la manucure).,Ngà'mfɑ̌'nkàb.
Un/une réceptionniste.,Ndàhngèn.
"Un/une sage-femme, un accoucheur, une accoucheuse, un maïeuticien.",Nkômōō.
Une femme de ménage.,Ngòōndʉ̄ɑ̄.
Une hôtesse de l'air/hôtesse d'avion.,Ndàhwěn ndʉ̂'fōh/sāktēnɑ̄. Ngà'mfɑ̌' ndʉ̂'fōh/sāktēnɑ̄.
Mon grand-père était bûcheron.,Mbɑ̄' ō ndāmɑ̀ lɑ̌' mɑ́ ngwààtàm.
Mon mari est charpentier.,Ndū á mɑ́ nshwììpè'è.
Chapitre 8. Phrases pour les voyageurs.,Nzâknù 8. Ghə̀ə̄ pɑ̌ngěntōm.
"Le serpent qui reste à un même endroit n'a pas de proie. À la fin de ce chapitre, vous connaitrez le langage des voyageurs en langue fè'éfě'è.","Nú nsī zʉ̌'nshʉ̀', ǎ lɑ̀ mí sə̀ə̄wū! Ǒ ìndī' měh béé sìèsì lè mɑ̀ ǒ zhí ghə̀ə̄ pɑ̀ngèntōm mɑ̀ ghə̀ə̄ fè'éfě'è."
Quelle heure est-il?,Yàā ndɑ̀h béè? Nàm sʉ̄'ʉ̄ béè?
Quel temps fait-il?,Nshʉ̀ɑ̀nzɑ́ mɑ̀ lāhā?
Le bus arrive.,Sʉ̀ɑ̀ndʉ́' mɑ̀nsɑ́'.
Le train arrive bientôt.,Mēndɑ̀' yǒkndʉ̄' sɑ̂'.
Où vas-tu?,Ǒ ngén mɑ̀ hɑ̄?
Je vais en voyage.,Ngɑ̌(mɑ̀) ngén mɑ̀ tōm.
Où vas-tu en voyage ainsi?,Ǒ mɑ̀ngén tōm mɑ̀ hɑ̄ fà'á ā?
Un voyage.,Tɑ̀' tōm/tə̄b.
"Voyager, aller en voyage.",Ngéntōm/ngéntə̄b.
"Les passagers, les voyageurs.",Pɑ̌ngěntōm.
Ces places-là sont prises.,Pó yá' lǎh zʉ̀' báá. Pʉ̀nǒk nɑ́ zʉ̀' báá.
Puis-je m'asseoir à côté de toi?,Pɑ́ ǹ nsī ngǎk ò ó?
"Oui, il n'y a pas de problème.","Ŋ̄h, ncà' sī wū bɑ̄."
Avec plaisir.,Mɑ̀ cà'sì. Pí mbə̀'nthʉ̄.
S'il vous plait Madame.,Mɑ́ mbɑ̌ mɑ̄!
Est-ce que je peux vous aider?,Mbɑ́ ǹ nkōsī ō ó?
De quoi avez-vous besoin?,Kɑ́ tɑ́ ó mɑ̀nkwé' ē?
"S'il te plait, peux-tu te reculer?",Cʉ̄cō'ò pɑ́ ó fhʉ̄'sī nā ō ó?
Il n'y a pas de place ici,Zʉ̀' sī séé bɑ̄.
Il n'y a plus de place ici.,Zʉ̀' sī yǎt séé bɑ̄.
Ne t'assois pas là-bas.,Ǒ sì sī sáá.
Viens t'asseoir à côté de moi.,Sɑ̀' nsī ngǎk à.
Merci beaucoup.,Ngɑ̌ pén ō tɑ̀ kēēmbʉ̄ɑ̄.
Enchanté.,Nthʉ̄ á lōh mɑ̀ cà'sì.
Jusqu'où allez-vous?(À plusieurs personnes),Pěn(mɑ̀)ngén tɑ̌ hɑ̄?
Nous allons jusqu'à Banwa.,Pɑ̌h(mɑ̀)ngén tɑ̌ Ŋwēē.
Nous allons faire du tourisme.,Pɑ̌h mɑ̀ngén kāāmɑ̄njīī.
"Nous allons voir la chute, l'abîme et le lieu sacré appelé Lǒhnzîsǒ.","Pɑ̌h mɑ̀ngén yīī vàhvàh/zə̀'zə̀', zàmɑ̀ pí Lǒhnzîsǒ."
Où est l'hôtel?,Ndʉ̄ɑ̀ngěn mɑ̀ hɑ̄?
"Oui, je sais parler anglais.",Ŋ̄h! Ngɑ̌ zhí làh ngə́ə́ Nglǐsì.
D'où es-tu? [Question à un homme],Ǒ mɑ́ yǐ hɑ̄? Ǒ mɑ́ mīā hɑ̄?
Il fait très chaud.,Zʉ̌' kòndóm/mɑ̀ndə́b tɑ̀'.
Baisse les vitres de la voiture s'il te plait.,"Fī'sī yīīsì ndʉ̄' lɑ́, ngɑ̌ lɑ̀ɑ̀sì ō."
Il fait légèrement froid.,Fóh mɑ̀ nɑ̄' nkō.
Monte les vitres de la voiture s'il te plait.,Kō'sī yīīsì ndʉ̄' lɑ́ cʉ̄cō'ò.
J'ai besoin de renseignements.,Ngɑ̌ mɑ̀nkwé' làh nté'sí nù.
"J'écoute, je comprends.",Ngɑ̌ mɑ̀njū'.
Combien de temps cela prend-il d'ici à Bafang.,Làh ndó séé ndhí Fá' nsī mvàk lāhā?
Ça prend quatre heures.,Yáá ndáh nàm kwɑ̀.
"Ça prend cinq heures en train, et une heure en avion.","Yáá ndáh nàm tî pí yǒkndʉ̄', nàm nshʉ̀' pí ndʉ̂'fōh."
"Ne prends pas le bateau, ça met long en route.","Ǒ sì láh ndʉ̂'nshì, yáá nsī mɑ̄nzhì yə̄ə̄."
Tu as compris?,Ǒ yú' ù?
J'ai bien compris.,"Ngɑ̌ yú' pə̀pē'/mbə̀pə̄', ngɑ̌ còh njū'."
Tu comprends la langue fè'éfě'è?,Ǒ njū' ghə̀ə̄ fè'éfě'é?
Je ne comprends pas.,Ǹ sī mɑ̀njū' bɑ̄.
