Francais,Nufi
Chapitre 1. Faire les présentations.,Nzâknù 1. Lɑ̀'sǐnā.
"Se présenter, c'est-à-dire parler de soi est la chose la plus instinctive du monde. À la fin de ce chapitre, vous serez en mesure non seulement de vous présenter correctement en langue fè'éfě'è, mais aussi de poser les questions à votre interlocuteur pour mieux le connaitre.","Làh ndɑ́'sí nā wěn mɑ́ ntûmbhì wū yì mbɑ̀wɑ̄lɑ́ nnēē nkwá'sí làh ngʉ́ sīècɑ́' è lɑ́. Ǒ ìndī' měh béé sìèsì lè mɑ̀ ǒ còh nzhī làh ndɑ́'sí nā ō, mbát nté'sí nǔ mbhí wèn yì yēē pɑ́h í mɑ̀nsāhnù lɑ́, ɑ́ lǎh cǒh zhī ì."
Salut.,Mbə̄ə̄ lɑ́!
Salut mon frère/ma sœur.,Mbə̄ə̄ lɑ́ mēmmɑ̄ ò!
Comment ça va?,Yáá mɑ̀ lāhā?
Ça va bien.,Yáá mɑ̀nnák
"Ça va bien, merci.","Yáá mɑ̀nnák, ngɑ̌ pén ō."
Et toi?,Wò yō lɑ́ ō?
"Je suis en santé, merci.","Ngɑ̌ ntèn, ngɑ̌ pén ō."
Qui es-tu?,Ǒ mɑ́ wɑ̄?
Présente-toi.,Lɑ̀'sǐ nā ò.
Comment tu t'appelles? Quel est ton nom?,Zēn zǒ mɑ́ wɑ̄?
Je m'appelle … mon nom est…,Zēn zǎ mɑ́…
Je m'appelle Ngèēnzhwî; mon nom est Ngèēnzhwî.,Zēn zǎ mɑ́ Ngèēnzhwî.
Quel âge as-tu?,Ǒ ghʉ̌ ngù' sʉ̄'ʉ̄? Ǒ ghʉ̌ ngǔ'nzɑ̄ sʉ̄'ʉ̄?
J'ai neuf ans.,Ngɑ̌ ghʉ̌ ngǔ'nzɑ̄ vʉ̀'ʉ̄.
"Et toi, quel âge as-tu?","Wò yō, ǒ ghʉ̌ ngǔ'nzɑ̄ sʉ̄'ʉ̄?"
J'ai 25 ans.,Ngɑ̌ ghʉ̌ ngǔ'nzɑ̄ ncɔ̀ tî mɑ̀ mʉ̄mbʉ́ɑ́.
Quel est ton éloge(nom honorifique)?,Ndɑ̀ɑ̀ mǒ mɑ́ kɑ́?
Mon éloge(nom honorifique)est Zadjeu.,Ndɑ̀ɑ̀ mǎ mɑ́ Nzɛ̄ɛ̀nzhʉ̀ɑ̀'
Qui est cette personne?,Wɑ̄ béé è?
Qui est-ce? C'est qui?,Wɑ̄ bɑ́ ɑ̄?
Qui est-il/elle?,Ǎ mɑ́ wɑ̄?
C'est mon ami(e).,Sēn à bɑ́.
Il/elle est mon ami(e).,Ǎ mɑ́ sēn à.
Comment s'appelle ton ami?,Zén sēn ǒ mɑ́ wɑ̄?
Comment s'appelle-t-il/elle?,Zēn zǐ mɑ́ wɑ̄?
Mon ami s'appelle Yámɑ̄nì.,Zén sēn ǎ mɑ́ Yámɑ̄nì.
Quel âge a-t-il?,Ǎ ghʉ̌ ngù' sʉ̄'ʉ̄? Ǎ ghʉ̌ ngǔ'nzɑ̄ sʉ̄'ʉ̄?
As-tu des amis?,Ǒ ghʉ̌ nse᷄n?
J'ai un ami.,Ngɑ̌ ghʉ̌ tɑ̀' sēn.
Il s'appelle Mfìènkàk.,Zēn zǐ mɑ́ Mfìènkàk.
J'ai un ami garçon.,Ngɑ̌ ghʉ̌ tɑ̀' sēn yì mbâ'.
J'ai une amie fille.,Ngɑ̌ ghʉ̌ tɑ̀' sēn yì mʉ̀nzhwīē.
J'ai un ami garçon et une amie fille.,Ngɑ̌ ghʉ̌ tɑ̀' sēn yì mbâ' pí tɑ̀' sēn yì mʉ̀nzhwīē.
Et,Pí
Avec qui?,Pí wɑ̄?
Avec quoi?,Pí kɑ́?
Avec moi.,Pí mʉ̀.
Avec qui est-elle venue?,Ǎ sɑ̀' pí wɑ̄?
Elle est venue avec sa mère.,Ǎ sɑ̀' pí mɑ̄ ā.
Avec quoi est-elle venue?,Ǎ sɑ̀' pí kɑ́?
Elle est venue avec la viande.,Ǎ sɑ̀' pí mbɑ̀ɑ̀.
Comment s'appellent tes amis?,Nzén nsēn mbǒ mɑ́ wɑ̄?
Ils s'appellent …,Nzēn yɑ̀ɑ́ mɑ́ …
Connais-tu son nom?,Ǒ zhí zēn zǐ?
"Non, je ne connais pas son nom.","Ngǎ', ǹ kɑ̀' zhī zēn zǐ bɑ̄."
"Non, pas du tout.","Ngǎ' nā à, zǎ!"
"Oui, je sais.","Ŋ̄h, ngɑ̌ zhí."
"Non, je ne sais pas.","Ngǎ', ǹ kɑ̀' zhī bɑ̄."
"Je crois, je pense.",Ngɑ̌ kwà'.
Je crois que oui.,"Ngɑ̌ kwà' fà'á, ngɑ̌ kwà' mɑ́ ŋ̄h."
Je ne crois pas.,"Ǹ kɑ̀' kwá' bɑ̄, ǹ kɑ̀' kwá' fà'á."
J'ai quatre frères et sœurs.,Ngɑ̌ ghʉ̌ póómɑ̄ kwɑ̀.
Aimes-tu les amis??,Ǒ nkə́' nse᷄n?
Je n'ai pas d'ami.,Ǹ kɑ̀' ghʉ́ sēn bɑ̄.
Je n'aime pas les amis.,Ǹ sǐ' nkwé' nsēn bɑ̄.
"Même pas un peu, pas du tout.","Mbɑ̀ nèhē, mbɑ̀ mēnsə̀ə̀."
Je n'aime du tout pas la viande.,Ǹ kɑ̀' kwé' mbɑ̀ɑ̀ mbɑ̀ nèhē.
As-tu un ordinateur?,Ǒ ghʉ̌ sāhndó' ó?
Oui j'ai un ordinateur.,Ŋ̄h! Ngɑ̌ ghʉ̌ sāhndó'.
Bien sûr! J'ai ça.,Ŋ̄h bɑ̂! Ngɑ̌ ghʉ̌ yāā.
"De nos jours, chacun devrait avoir ça.",Nɑ́ nzɑ́ ngǔ'è lè mbɑ̀wɑ̄lɑ́ ghʉ̀ mbʉ́ɑ́ ghʉ̌ yāā.
As-tu un téléphone?,Ǒ ghʉ̌ lòlò ó? Ǒ ghʉ̌ nkhʉ̌nkěn?
Oui j'ai un téléphone.,Ŋ̄h! Ngɑ̌ ghʉ̌ nkhʉ̌nkèn.
"Non, je n'ai pas de téléphone.",Ngǎ'! Ǹ kɑ̀' ghʉ́ nkhʉ̌nkèn(bɑ̄).
Je n'en ai pas besoin.,Yāā sǐ' mfɑ́' sə̀ə̄wú mbú á bɑ̄. Yāā sǐ' nkōsī á nɑ́ sə̀ə̄wú bɑ̄.
Ta mère a une voiture?,Mɑ̄ é ghʉ̌ ndʉ̄' ʉ́?
"Non, elle n'a pas de voiture. Elle est pauvre.","Ngǎ', à kɑ̀' ghʉ́ ndʉ̄'. Ǎ mɑ́ mbōk/ngà'mbōk."
Ne t'en fais pas.,Ǒ sì cə̄ə̄.
Aimes-tu l'école?,Ǒ kwě' nǔ ŋwɑ̀'nì í?
Je n'aime pas aller à l'école; cette histoire est très difficile.,Ǹ sǐ' nkwé' làh ngén ŋwɑ̀'nì bɑ̄; báá wú ngɑ́' tɑ̀'.
As-tu des frères et sœurs?,Ǒ ghʉ̌ póómɑ̄ ɑ́?
Combien de sœurs as-tu?,Ǒ ghʉ̌ póómɑ̄ pʉ̌nzhwīē sʉ̄'ʉ̄?
Combien de frères as-tu?,Ǒ ghʉ̌ póómɑ̄ pōōmbā' sʉ̄'ʉ̄?
J'ai un frère.,Ngɑ̌ ghʉ̌ tɑ̀' mēmmɑ̄ yì mbâ'.
Mon frère s'appelle Cīēncə̄ə̄.,Zén mēmmɑ̄ ò mbá' mɑ́ Cīēncə̄ə̄.
J'ai deux frères et une sœur.,Ngɑ̌ ghʉ̌ póómɑ̄ pōōmbā' pʉ́ɑ́ mbát ngʉ́ mēmmɑ̄ mʉ̀nzhwīē nshʉ̀'.
Ma sœur s'appelle Púángāp.,Zén mēmmɑ̄ ò mʉ̀nzhwíé mɑ́ Púángāp.
"Je n'ai aucun frère, je suis enfant unique.","Ǹ kɑ̀' ghʉ́ sə̀ə̄ mēmmɑ̄, ngɑ̌ mɑ́ nshwìè mōō."
Y a-t-il des animaux chez vous?,Nə̀ə́ mbɑ̄ mbèé pěn?
Vous élevez des animaux?,Pěn nnāk nə̀ə̀ ə́?
Nous élevons des chèvres.,Pɑ̌h nnāk mvī.
Nous élevons des poules.,Pɑ̌h nnāk ngāp.
Avez-vous un chien?,Pěn ghʉ̌ mvʉ̄ɑ̄ ɑ́?
Oui! Nous avons un chien.,Ŋ̄h! Pɑ̌h ghʉ̌ tɑ̀' mvʉ̄ɑ̄.
J'ai aussi un chat.,Mbɑ̀ mʉ̀ ngɑ̌ ghʉ̌ ngòòndōm. Mbɑ̀ mʉ̌ ghʉ̌ tɑ̀' ngòòndōm.
Je n'aime pas le chat.,Ǹ kɑ̀' kwé' ngòòndōm(bɑ̄).
As-tu peur du chien?,Ǒ mbōh mvʉ̄ɑ̄ ɑ́?
Je déteste le chien.,Ngɑ̌ mbéé mvʉ̄ɑ̄.
Qui est ta mère?,Mɑ̄ é mɑ́ wɑ̄?
Comment s'appelle ta mère?,Zén mɑ̄ é mɑ́ wɑ̄?
Ma mère s'appelle Kouemo.,Zén mɑ̄vǒ mɑ́ Nkwèèmōō.
Comment s'appelle ton enseignant?,Zén nsìènsì ǒ mɑ́ wɑ̄?
Mon enseignant s'appelle monsieur Ngatcheu.,Zén nsìènsì ǎ mɑ́ mbɑ̄' Ngǎ'ncə̄ə̄.
Mon enseignante s'appelle madame Deukam.,Zén nsìènsì ǎ mɑ́ mɑ̄vǒ Ndə̀ə̄nkām.
Dans quel pays vis-tu?,Ǒ nsī mɑ̀ nɑ́ yàā lɑ̄'?
J'habite aux Etats Unis d'Amérique.,Ngɑ̌ nsī mɑ̀ ntám Kwèēlɑ́' Āmērīkà.
Dans quelle ville habites-tu?,Ǒ nsī mɑ̀ nɑ́ yàā tūsè'?
J'habite à Dschang.,Ngɑ̌ nsī mɑ̀ Cà'.
De qui es-tu l'enfant?,Ǒ mɑ́ mên wɑ̄?
Qui est ton père?,Mbɑ̄' é mɑ́ wɑ̄?
Comment s'appelle ton père?,Zén mbɑ̄' é mɑ́ wɑ̄?
Mon père s'appelle Djiadeu.,Zén mbɑ̄' ó mɑ́ Zhìāndə̀ə̀.
Avez-vous une radio?(A une seule personne),Ǒ ghʉ̌ mbǔ'nkěn?
Écoutes-tu souvent la radio?,Ǒ ngʉ́ njū' mbǔ'nkěn?
J'écoute la radio chaque jour.,Ngɑ̌ njū' mbǔ'nkèn nkwèè līē'.
Je n'écoute pas la radio.,Ǹ sǐ' njū' mbǔ'nkèn bɑ̄.
En quelle classe es-tu?,Ǒ nɑ́ yàā ndʉ̄ɑ̀ŋwɑ̀'nì?
Je suis en quatrième année de l'école primaire.,Ngɑ̌ nɑ́ ndʉ̄ɑ̀ kwɑ̌ nɑ́ ntūmbhì wǎ'ŋwɑ̀'nì.
Je ne vais plus à l'école.,Ǹ sǐ' nját ngén ŋwɑ̀'nì bɑ̄.
Es-tu marié?,Ǒ lə́ə́ndʉ̄ɑ̄ ɑ́?
"Oui, je suis déjà marié.","Ŋ̄h, ngɑ̌ yá' lə̄ə̄ndʉ̄ɑ̄."
"Non, je ne suis pas encore marié(e).","Ngǎ', ǹ njǎt sì lə̄ə̄ndʉ̄ɑ̄(bɑ̄). Ngǎ', ǹ njǎt sì tɑ̄ ndə̄ə̄ ndʉ̄ɑ̄(bɑ̄)."
Je suis encore célibataire.,Ǹ njǎt mɑ́ nshwìèwèn.
Je suis divorcé(e).,Ngɑ̌ tóm lə́ə́ndʉ̄ɑ̄.
Où as-tu grandi?,Ò lɑ̀shwí mɑ̀ hɑ̄?
J'ai grandi au village.,Ǹ dɑ̀shwí mɑ̀ mbèè.
Je n'ai pas grandi avec mes parents.,Ǹ dɑ̀ sì shwī pí mbɑ̄' ō mbɑ̀ mɑ̄vǒ.
Où habites-tu?,Ǒ nsī mɑ̀ hɑ̄?
Je suis un(e) villageois(e).,Ngɑ̌ mɑ́ nsîmbèè.
Où iras-tu pendant les vacances?,Ǒ ìngén hwīēsì mɑ̀ hɑ̄?
J'irai en vacances à Douala.,Ngɑ̌ ìngén hwīēsǐ ɑ́ Ndùālə̄ə̄.
Quel genre de jeu aimes-tu?,Yàā ntīē sʉ̀ɑ̀ tɑ́ ó nkwé' ē?
Quel est ton passe-temps? Quel est ton hobby?,Yò wúpíéndɑ̌h mɑ́ kɑ́?
Mon passe-temps c'est écouter de la musique.,Yà wúmǒ mɑ́ làh njū' yɔ̌nshì.
J'aime courir; j'aime la course à pied.,Ngɑ̌ nkwé' làh nkhʉ́ɑ́ndʉ̄ɑ̄; ngɑ̌ kwě' nkhǔndʉ́ɑ́ nkhù.
Je n'ai aucun loisir/hobby.,Ǹ kɑ̀' ghʉ́ sə̀ə̄ wúpíéndɑ̀h.
Aimes-tu danser?,Ǒ kwě' làh nzēnshì í?
Aimes-tu écouter de la musique?,Ǒ nkə́' làh njū' yɔ̌nshì í?
Aimes-tu la lecture?,Ǒ kwě' céhwū ú?
Aimes-tu la nage/natation?,Ǒ kə̌' náhnshì í?
Aimes-tu nager?,Ǒ nkwé' làh nnāhnshì í?
Je n'aime pas la nage.,Ǹ kɑ̀' kwé' náhnshì(bɑ̄).
"Oui, j'aime la nage, mais je ne sais pas nager.","Ŋ̄h! Ngɑ̌ kwě' náhnshì, tɑ́' ǹ kɑ̀' zhī làh nnāhnshì."
Aimes-tu le sport?,Ǒ kwě' sʉ̀ɑ̄mfʉ̀'nā á?
J'aime tellement le sport.,Ngɑ̌ kwě' sʉ̀ɑ̄mfʉ̀'nā tɑ̀ mbʉ́ɑ́ lɑ̀ bɑ̄.
Aimes-tu les enfants?,Ǒ kwě' pʉ̄nkhʉ̄ɑ̄ ɑ́?
J'aime tellement les enfants.,Ngɑ̌ nkwé' pʉ̄nkhʉ̄ɑ̄ tɑ̀ kēēmbʉ̄ɑ̄.
Aimes-tu les vacances?,Ǒ kwě' ntìè' ē hwīēsì í?
"Non, je suis un accro au travail.","Ngǎ', ngɑ̌ mɑ́ mfɑ̀'ndīēkò."
Quel genre de musique aimes-tu?,Yàā ntīē yɔ̌nshì tɑ́ ó nkwé' ē?
J'aime le Madjong-Lali.,Ngɑ̌ kwě' Mɑ̂njwè'-Lālī.
Quel est ton chanteur préféré?,Yàā njɔ̀nshì tɑ́ ó nkwé' nshʉ́ɑ́ zìmó' ō?
Préférer.,Nkwé' nshʉ́ɑ́(mò').
Je préfère le couscous manioc au couscous maïs.,Ngɑ̌ nkwé' nkòmnkòm nshʉ́ɑ́ nsā'.
J'aime le poisson braisé plus que le rôti de viande.,Ngɑ̌ nkwé' tòō mbɑ̀ɑ̄nshì nshʉ́ɑ́ yì mbɑ̀ɑ̀.
Quel est ton repas préféré?,Yàā ntīē wúzɑ̄ tɑ́ ó nkwé' nshʉ́ɑ́ zìmó' ō?
Mon repas préféré est le couscous manioc avec la sauce pistache.,Wúzɑ̄ yì ngɑ̌ nkwé'(tɑ̀) nshʉ́ɑ́ zìmó' lɑ́ mɑ́ nkòmnkòm nɑ̂' nzhʉ̀'.
Quelle est ta profession?,Yò túmfɑ̌' mɑ́ kɑ́?
Je suis étudiant informatique.,Ngɑ̌ mɑ́ ngà'ŋwɑ̀'nǐ nɑ́ zhínǔsāhndó'.
Je suis un chercheur.,Ngɑ̌ mɑ́ tɑ̀' ncâkngà'.
Regardes-tu souvent la télévision?,Ǒ ngʉ́/nnēē njīī mbǔ'nkěn-yīīsì í?
"Non, pas du tout! Regarder la télévision est une perte de temps.",Ngǎ' nā à! Làh njīī mbǔ'nkěn-yīīsǐ mɑ́ píéndɑ̀h.
Sais-tu cuisiner?,Ǒ zhí làh ndə̄ə̄/nā' wúzɑ̄ ɑ́?
Je ne suis pas une femme.,Ǹ sī mɑ́ mʉ̀nzhwīē bɑ̄.
Chez nous ce sont les femmes qui cuisinent.,Yáá mbɑ̄ wú pɑ̀h pʉ̌nzhwīē bɑ̄ mɑ̄ndə̄ə̄ wúzɑ̄.
"Oui, je sais cuisiner.",Ŋ̄h ngɑ̌ zhí làh ndə̄ə̄/nā' wúzɑ̄.
Quel genre de plat sais-tu cuisiner?,Yàā ntīē wúzɑ̄ tɑ́ ó zhī làh ndə̄ə̄ ə̄?
Je peux préparer tout genre de mets.,Pɑ́ ǹ ndə̄ə̄/nnā' nkwèè ntīē zúzɑ̄.
Sais-tu conduire?,Ǒ zhí làh mfák ndʉ̄' ʉ́?
Oui j'ai un permis de conduire.,Ŋ̄h! Ngɑ̌ ghʉ̌ ŋwɑ̀'nǐkóntá' làh mfákndʉ̄'.
"Non, je n'ai pas encore de permis de conduire.","Ngǎ', ǹ njǎt sì tɑ̄ ngʉ́ ŋwɑ̀'nǐ làh mfákndʉ̄'."
Je n'ai pas encore de l'argent pour faire ça.,Ǹ njǎt sì ghʉ̌ nkɑ̄ɑ̄ làh ngʉ́ yāā.
Ton père a une voiture?,Mbɑ̄' é ghʉ̌ ndʉ̄' ʉ́?
Mon père n'aime pas la voiture.,Mbɑ̄' ō sǐ' nkwé' ndʉ̄' bɑ̄.
"Mon père est un pauvre, par conséquent, il n'a pas la voiture.","Mbɑ̄' ó mɑ́ ngà'mbōk, fà'á lɑ́, à kɑ̀' ghʉ́ ndʉ̄' bɑ̄."
"Mon père n'a pas d'argent, c'est pour ça qu'il n'a pas la voiture.","Mbɑ̄' ō kɑ̀' ghʉ́ nkɑ̄ɑ̄ bɑ̄, nǔ yāā tɑ́ á kɑ̀' ghʉ́ ndʉ̄' bɑ̄."
Y a-t-il des souris chez vous?,Cwǎkhǔ mbɑ̄ mbèé pěn?
Non il n'y a aucune souris chez nous.,Ngǎ'! Cwǎkhù sǐ' mbɑ̄ mbèé pɑ̀h bɑ̄.
"Oui, il y a des souris chez nous.",Ŋ̄h! Cwǎkhǔ mbɑ̄ mbèé pɑ̀h.
"La nuit tombe déjà, il faut que je parte.",Njǎm yá' mɑ̄ngwɑ́. Yáá ncāk mɑ́ ń nshʉ̀ɑ̀/ngènɑ̀!
"Il n'y a pas de problème mon frère/ma sœur, au revoir.","Ncà' sī wū bɑ̄ mēmmɑ̄ ò, ôhó."
Chapitre 2. Salutations et accueil.,Nzâknù 2. Cɑ̀'sì pí mbʉ́ɑ́ lǎh wèn.
"Sans les salutations, la cohésion familiale disparaît. À la fin de ce chapitre, vous serez en mesure de saluer les gens correctement en langue fè'éfě'è.","Ndʉ̄ɑ̀ sì cɑ̀'sì lɑ̀píé. Ò yéé mēmmɑ̄ è, ǒ sì táh sì lēn mbú í mɑ́ mbə̄ə̄ lɑ́ mēmmɑ̄ ò, nzɑ́ lēē è sēn à? Ǒ vɑ́h yō ò mɑ̄? Ǒ ìndī' měh béé sìèsì lè mɑ̀ ǒ còh nzhī làh ncɑ́'sí wèn."
Bienvenue!,Sɑ̌' pə̀pē'/mbə̀pə̄'! Sɑ̀' mbə̄ə̄!
"Merci mon frère, ma sœur.",Ngɑ̌ pén ō mēmmɑ̄ ò!
Bienvenue mon père!,Sɑ̌' mbə̀pə̄' lɑ́ mbɑ̄' ō!
Bienvenue maman!,Sɑ̀' mbə̄ə̄ lɑ́ mɑ̄!
Merci mon enfant.,Ngɑ̌ pén ō mēn à!
Soyez les bienvenus!(A plusieurs personnes),Pèn sɑ́' pə̀pē'! Pèn sɑ́' mbə̄ə̄!
Nous vous remercions.,Pɑ̌h pén yēē.
Bonjour!,Nzɑ́ lēē è?
Bonjour!(Réponse au bonjour),Yáá lēē zǐ. Ǎ léé yī.
Bonjour à toi!,Nzɑ́ lēē mbú ò? Yò nzɑ́ lēē è?
Bonjour à tous!,Nzɑ́ lēē mbí pèn? Yèè nzɑ́ lēē è?
Bonjour!(Réponse au bonjour quand plusieurs personnes répondent.),Yáá lēē zǐ. Ǎ léé yī. Yòh nzɑ́ lēē.
Bonjour ma femme.,Nzɑ́ lēē è nzhwīē à?
Bonjour mon mari.(Réponse au bonjour. Une femme à son mari.),Yáá lēē zǐ ndū à.
Bonjour mes frères et sœurs.,Nzɑ́ lēē è póómɑ̄ ō?
Bonjour mon ami.,Nzɑ́ lēē è sēn à?
Salut!,Mbə̄ə̄ lɑ́!
"Salut mon frère, ma sœur!",Mbə̄ə̄ lɑ́ mēmmɑ̄ ò!
Salut mes frères.,Pèn pə̄ə̄ lɑ́ póómɑ̄!
Salut ma grand-mère.,Mbə̄ə̄ lɑ́ mɑ̄vǒ ndāmɑ̀!
Je te salue.,Ngɑ̌ cɑ̀'sì ō lɑ́!
Je te salue aussi.,Mbɑ̀ mʉ̀ ngɑ̌ cɑ̀'sì ō lɑ́!
"Je te salue, mon aîné(e).",Ngɑ̌ cɑ̀'sì ō lɑ́ ngà'mbhǐ à.
"Je te salue aussi mon cadet, ma cadette.",Mbɑ̀ mʉ̀ ngɑ̌ cɑ̀'sì ō lɑ́ ngà'njǎm à.
Je vous salue mes frères et sœurs.,Ngɑ̌ cɑ̀'sì yēē lɑ́ póómɑ̄/mfátmfāt!
Je vous salue mes mamans!,Ngɑ̌ cɑ̀'sì yēē lɑ́ pɑ̀mɑ̄ pǎ!
Quoi de neuf? Litt. quelles sont les nouvelles?,Cwè'/cə̀' mɑ́ kɑ́?
Rien de neuf. Tout est vieux; litt. les nouvellesse sont refroidies.,Cwě'/cə̌' hwíé/shwíé
Quelles sont les nouvelles de la famille?(Litt. de la maison),Cwè' mbèè mɑ́ kɑ́?
Tout le monde va bien à la maison.,Cwè'/cə̀' mbèé hwíé/shwíé.
"Bonne matinée à toi mon frère, ma sœur.",Mbè'mbè' fɑ́hnzɑ́ mbú ó lɑ́ mēmmɑ̄ ò.
"A toi aussi mon frère, ma sœur.",Mbɑ̌ mbú ó yǒ lɑ́ mēmmɑ̄ ò.
"Bonne soirée à toi mon frère, ma sœur.",Mbè'mbè' mbūànzɑ́ mbú ó lɑ́ mēmmɑ̄ ò.
Bonne nuit!,Dīē pə̀pē'/mbə̀pə̄'!
Bonsoir!,Ǒ vɑ́h yō ò? Mbè'mbè' mbūànzɑ̄ lɑ́.
Bonsoir maman!,Ǒ vɑ́h yō ò mɑ̄? Mbè'mbè' mbūànzɑ̄ lɑ́ mɑ̄.
Comment ça va?,Yáá mɑ̀ lāhā? Ǒ mɑ̀ lāhā?
"Ça va bien, merci.","Yáá mɑ̀nnák, ngɑ̌ pén ō."
Et toi?,Wò yō lɑ́ ō?
"Je suis en santé, merci.","Ngɑ̌ ntèn, ngɑ̌ pén ō."
Ça ne va pas.,Yāā sī mɑ̀nnák bɑ̄.
Comment vas-tu aussi?,Ǒ yō mɑ̀ lāhā?
Couci-couça [Litt. Je suis aussi-là].,Ngɑ̌ yǎ síé lè.
Couci-couça [Litt. Les choses sont juste une certaine quantité].,Nǔ mɑ́ mó' mvàk.
Comment allez-vous?(À plusieurs personnes),Pěn mɑ̀ lāhā?
Comment va ta famille?,Těndʉ̄ɑ̄ ó mɑ̀ lāhā? Yò těndʉ́ɑ́ mɑ̀ lāhā?
Comment vont les enfants?,Pʉ̄nkʉ́ɑ́ mɑ̀ lāhā?
Comment vont tes enfants?,Pōō mbǒ mɑ̀ lāhā?
Comment vont tes parents?,Mbɑ̄' ē pí mɑ̄ é mɑ̀ lāhā?
Ils sont tous en santé. Personne n'a un souci de santé.,"Pó ntèn wǎ', pó shwītōk. Sə̀ə̄wū sī mɑ̀ngʉ́ wèn bɑ̄."
"Couci-couça, comme ci, comme ça, ni bien ni mal. [Litt. c'est aussi-là comme ça.]",Yáá yǐ fà'á lɑ́.
"Couci-couça, comme ci, comme ça, ni bien ni mal. [Litt. une chose de grave ne s'est pas produite.]",Mǒ' ghɑ̀' nù kɑ̀' tōm.
"Couci-couça, comme ci, comme ça, ni bien ni mal. [Litt. on tombe et se relève.]",Wěn mɑ̀ntāmsīē mɑ̄ndó.
"Je ne suis pas en santé, je suis malade.","Ǹ sī ntèn bɑ̄, ngɑ̌ mɑ̀ngóó."
Je suis en santé.,Ngɑ̌ ntèn.
Je te remercie.,Ngɑ̌ pén ō.
Bonsoir mes frères et sœurs!,Pěn vɑ́h yēē è póómɑ̄ ō?
Bonsoir! [Réponse à pěn vɑ́h yēē è?],Pɑ̌h vɑ́h yǒh.
Merci mon fils/merci ma fille.,Ngɑ̌ pén ō mēn à.
Nous te remercions beaucoup.,Pɑ̌h pén ō tɑ̀'.
Restez en paix.,Pèn sī mɑ̀ mbūànì(lɑ́ mbɑ̀).
Restez bien.,Pèn sī pə̀pē'(lɑ́ mbɑ̀).
Restons bien.,Pɑ́h á pèn sī mbə̀pə̄' lɑ́ mbɑ̀.
Soyez les bienvenus! [A plusieurs personnes],Pèn sɑ́' mbə̀pə̄'/pə̀pē'!
Vous avez fait bonne route? [A plusieurs personnes],Tɑ̀ pěn còh nnák pə̀pē' è/mbə̀pə̄' ə̀?
Chapitre 3. Dire au revoir.,"Nzâknù 3. Dì'sì, ndí'sí."
"Le savoir-vivre voudrait qu'il ne faut jamais partir d'un lieu sans dire au revoir. À la fin de ce chapitre, vous serez en mesure de dire au revoir en langue fè'éfě'è.","Zhímbʉ́ɑ́ ndēn mɑ́, ò lí' lǒ nɑ́ tɑ̀' zʉ̌' ɑ́ shʉ̀ɑ̀, ǒ sì nʉ́ɑ́ sì cwě' nkǎb nɑ́ wèn. Ǒ ìndī' měh béé sìèsì lè mɑ̀ ǒ còh nzhī làh ndí'sí wèn."
"A bientôt, à tout à l'heure!",Tɑ̀ mêndɑ̀'(lɑ́ mbɑ̀)!
A bientôt! [Réponse],Tɑ̀ mêndɑ̀' lɑ́!
A ce soir.,"Tɑ̀ mbūànzɑ̄(lɑ́ mbɑ̀), tɑ̀ mbūànzɑ́ è."
A ce soir. [Réponse],Tɑ̀ mbūànzɑ̄ lɑ́.
A demain!,Tɑ̀ wāhà! ɑ́ nzɑ̄ lēē lɑ́ mbɑ̀.
A demain! [Réponse],Tɑ̀ wāhà lɑ́! ɑ́ nzɑ̄ lēē lɑ́.
"A quand, le prochain rendez-vous?",Pɑ̀h pát njīīsī sēnɑ̄ ɑ̄?
Revoyons-nous après-demain.,Pɑ̀h pát njīīsī njàmnzɑ̄ wāhà.
A la prochaine!,Tɑ̀ mó' līē'(lɑ́ mbɑ̀)!
"A la prochaine, si Dieu le veut.","Tɑ̀ mó' līē' lɑ́, yì mɑ̀ Síé pēn lɑ́."
Au revoir.,Ôhó!
Bonne nuit!,Dīē mbə̀pə̄'/pə̀pē'.
Fais de beaux rêves.,"Yīī mbè' nzhʉ̀ʉ̀, yīī nzhʉ̀ʉ̄ mbʉ̄ʉ̄."
Marche bien!,Na᷅k mbə̀pə̄'/pə̀pē'.
Que Dieu t'accompagne.,ɑ́ yēē pí Nshʉ̀ɑ̀pʉ̀ Sīē nák. ɑ́ Nshʉ̀ɑ̀pʉ̀ Sīē nák pí wò.
Que les ancêtres t'accompagnent.,ɑ́ yēē píá pɑ̀mfhʉ́sīē nák.
Chapitre 4. Poser les questions.,Nzâknù 4. Mbʉ́ɑ́ làh nté'sí nù.
"Si tu ne sais pas, demande! Mais l'extrême curiosité peut s'avérer fatale. À la fin de ce chapitre, vous serez en mesure de poser les questions en langue fè'éfě'è.","Ò sǐ' nzhī wū bɑ̄, ò tē'sî! Tɑ́', nɑ́h ntè'zɑ̄h lɑ̀có tììmōh. Ǒ ìndī' měh béé sìèsì lè mɑ̀ ǒ còh nzhī làh nté'sí nǔ mbí wèn mɑ̀ ghə̀ə̄ fè'éfě'è."
Où est l'enfant?,Móó mɑ̀ hɑ̄?
Il est dans la chambre.,Ǎ mɑ̀ ntámndʉ̄ɑ̄.
Il n'est pas là-bas.,À sī mʉ̀ bɑ̄.
Ah bon?,Fà'á á? Ndéndēē é?
"Dans ce cas, elle est au salon.",Ò zhī mɑ́ á mɑ̀ ndʉ̄ɑ̀mò.
Peut-être il est à la cuisine.,Mbé'ntìè' mɑ̀ ǎ mɑ̀ ndʉ̄ɑ̀lə̄ə̄.
Il doit être à la cuisine.,Ǎ ìmbɑ̄ mɑ̀ ndʉ̄ɑ̀lə̄ə̄.
L'enfant a mangé?,Móó zɑ̄ wúzɑ̄ ɑ́?
"Oui, l'enfant a mangé.","Ŋ̄h, móó zɑ̄ wúzɑ̄."
Pourquoi pleure-t-il alors?,Tɑ̀ nǔkɑ́ á mɑ̀ngé' ē?
Il pleure parce qu'il est fâché.,Ǎ mɑ̀ngé' mbī'tū mɑ́ á mɑ̀njā'nthʉ̄.
"Non, l'enfant n'a pas mangé.","Ngǎ', mōō kɑ̀' zɑ̄ wúzɑ̄(bɑ̄)."
"Non, il/elle n'a pas encore mangé.","Ngǎ', à kɑ̀' tɑ̄ nzɑ̄ wúzɑ̄(bɑ̄)."
Il/elle n'a pas encore mangé.,À yǎt sì zɑ̄ wúzɑ̄(bɑ̄).
"Pardonne-moi, je t'ai menti.","Lɑ̀hsì ā lɑ́, ngɑ̌ fʉ̀ɑ̀ ō."
L'enfant est en train de manger maintenant?,Móó mɑ̀nzɑ̄ wúzɑ̄ ntìé' é?
Il n'est pas en train de manger maintenant.,"Ngǎ', à sī mɑ̀nzɑ̄ wúzɑ̄ ntìé' bɑ̄."
Qui fait du bruit?,Wɑ̄ bɑ́ mɑ̀njwáásí ī?
Ce n'est pas moi.,Sī mʉ̀ bɑ́ bɑ̄.
Qu'est-ce qui fait donc bruit?,Tɑ̀ kɑ́ bɑ́ mɑ̀njwáásí ī?
Ça doit être la souris.,Yáá ìmbɑ̄ mɑ̀ cwǎkhù bɑ́.
Quand est-ce que ta grand-mère est venue?,Mɑ̄ ē ndāmɑ̀ lɑ̀sɑ̌' sēnɑ̄ ɑ̄?
Elle était venue avant-hier.,À lɑ̀sɑ̌' njàmnzɑ̄ wāhà.
À quelle heure est-ce que ton père est allé au travail?,Mbɑ̄' é fhʉ̄ngén mfɑ̌' nɑ́ nàm sʉ̄'ʉ̄?
Je ne sais pas moi.,Ǹ kɑ̀' zhī zǎ(bɑ̄).
Mon père est allé au travail à sept heures et demie.,Mbɑ̄' ó fhʉ̄ngén mfɑ̌' nɑ́ nàm sə̀ə̀mbʉ́ɑ́ mɑ̀ kàm.
Il est parti avec qui?,Ǎ shʉ̀ɑ̀ pí wɑ̄?
Il est parti seul.,Ǎ shʉ̀ɑ̀ ndǒk ì.
Il n'est pas parti avec sa mère?,À kɑ̀' shʉ́ɑ́ pí mɑ̄ ā á [mɑ᷄]?
Avec qui?,Pí wɑ̄?
Avec qui(quand c'est la 2ème fois qu'on pose la question)?,Pí wɑ̄ lī?
Avec mes parents.,Pí mbɑ̄' ō mbɑ̀ mɑ̄vǒ.
De qui es-tu l'enfant?,Ǒ mɑ́ mên wɑ̄?
Je suis l'enfant de papa Mbeu'Nambou.,Ngɑ̌ mɑ́ mên táàwɑ̄ Mbʉ̂' Nǎ'mbū'.
Où es-tu né?,Pō lɑ̀zí ō mɑ̀ hɑ̄?
Je suis né à Mbanga.,Pō lɑ̀zí ā mɑ̀ Mbàngā.
Où est votre maison/village?,Mbèè yèé mɑ̀ hɑ̄?
Notre village est Baboutcheu-Ngaleu.,Mbèè yǒh mɑ̀ Póóncə̄ə̄-Ngǎ'lʉ̄ɑ̄'.
Où est le village natal de ta mère?,Zʉ̌'zí mɑ̄ é mɑ̀ hɑ̄? Lɑ́'zí mɑ̄ é mɑ̀ hɑ̄? Pō lɑ̀zí mɑ̄ ē mɑ̀ hɑ̄?
Mon lieu de naissance(mon village natal) est Bandja.,"Zʉ̌'zī á mɑ̀ Njə̄ə̄, lɑ́'zī á mɑ̀ Njə̄ə̄."
Quand et où es-tu né?,Pō lɑ̀zí ō sēnɑ̄? ɑ́ hɑ̄?
"Je suis né à Komako, au Cameroun, le 04 Octobre 2006.","Pō lɑ̀zí á Kōōkò, ɑ́ Kàmèrûn, líé'nzɑ̄ kwɑ̀, ndʉ̌'nzɑ̄, ngù' 2006."
À quelle heure es-tu venu?,Ǒ sɑ̌' nɑ́ yàā ndɑ̀h/ntìè'?
"Je suis venu depuis, il y a un bon bout de temps.",Ngɑ̌ fhʉ́nsɑ́' fhʉ̄(tɑ̀) ntìè'.
Avec quoi es-tu venu?,Ǒ lǎh kɑ́ nsɑ́' ɑ̄?
Je n'ai rien apporté.,Ǹ kɑ̀' láh sə̀ə̄wū nsɑ́'.
Quel genre de repas veux-tu?,Yàā ntīē wúzɑ̄ tɑ́ ó mɑ̀nkwé' ē?
Quel genre de boisson aimes-tu généralement?,Yàā ntīē ndū' tɑ́ ó(ngʉ́) nkwé' ē?
"Aucun, je ne bois pas de boisson.","Sə̀ə̄ yāā, ǹ sǐ' nnū ndù' bɑ̄."
Où vas-tu ainsi?,Ǒ ngén mɑ̀ hɑ̄ fà'á ā?
Nulle part. Je déambule.,Sə̀ə̄ zʉ̀'. Ngɑ̌ mɑ̀nkāā sì tú yāā.
Combien dois-je prendre?,Ń dǎh sʉ̄'ʉ̄?
Quelle quantité dois-je prendre?,Ń dǎh mvàk lāhā?
Es-tu venu aujourd'hui?,Ǒ sɑ̀' mɑ́ zě'é?
"Non, je suis venu plutôt hier.","Ngǎ', ǹ kɑ̀sɑ̌' mɑ́ wāhà."
Pourquoi es-tu venu ici?,Nǔkɑ́ ǒ sɑ̌' séè? Nǔkɑ́ ó nsɑ̌' séè?
Je suis venu vous rendre visite.,Ngɑ̌ sɑ̌' yə̀'/ywè' yēē.
Je suis venu chercher ton père.,Ngɑ̌ sɑ̌' cāk mbɑ̄' ē.
Qui est-ce? [En pointant quelqu'un près de moi],Wɑ̄ béè?
Qui est-ce? [En pointant quelqu'un près de celui à qui on parle.],Wɑ̄ báá ā?
Qui est-ce? [En pointant quelqu'un loin de ceux qui parlent.],Wɑ̄ bíì?
C'est mon petit frère.,Ngà'njǎm à(yì mbâ') bɑ́.
C'est ma grande sœur.,Ngà'mbhǐ à(yì mʉ̀nzhwīē) bɑ́.
Comment appelle-t-on ceci/ça?,Pó ncēh yāā lè mɑ́ kɑ́?
On appelle ça une brosse à dents. C'est une brosse à dents.,Pó ncēh yāā mɑ́ nshù'nsə̀'. Nshù'nsè' bɑ́.
Pourquoi pleures-tu?,Nǔkɑ́ ó mɑ̀ngé' ē?
Je pleure parce que Kambou m'a frappé.,Ngɑ̌ mɑ̀ngé' mbī'tū mɑ́ Kǎmbú' zàb ā.
Pourquoi pleure-t-il?,Nǔkɑ́ ǎ [nǔká] mɑ̀ngé' ē?  Ǎ mɑ̀ngé' nǔkɑ́?
Il/elle pleure parce qu'il/elle a faim.,Ǎ mɑ̀ngé' mbī'tū mɑ́ nzhìèkú' mɑ̀nkō ī.
Pourquoi a-t-il/elle faim?,Nǔkɑ́ nzhìèkú' mɑ̀nkō ī? Nzhìèkú' mɑ̀nkō ī nǔkɑ́?
Il/elle a faim parce qu'il/elle n'a rien mangé.,Nzhìèkú' mɑ̀nkō ī mbī'tū mɑ́ á kɑ̀' zɑ̄ sə̀ə̄wū.
Pourquoi ris-tu?,Nǔkɑ́ ǒ [nǔkó] mɑ̀nzhwíé ē?
Je ris parce que je suis content.,Ngɑ̌ mɑ̀nzhwíé mbī'tū mɑ́ nǔ mɑ̀mbé' ā [Ngɑ̌ mɑ̀ncá'sí].
Pourquoi l'as-tu tapé(e)/battu(e)?,Nǔkɑ́ ó zàb ī? Nǔkɑ́ ó nzàb ī? Ǒ zàb ī nǔkɑ́?
Je l'ai frappé parce qu'il a gâté mon jouet.,Ngɑ̌ zàb ī mbī'tū mɑ́ á pɑ̄psī wúsʉ̀ɑ̀ za᷅.
Je l'ai frappé parce qu'il m'a taquiné.,Ngɑ̌ zàb ī mbī'tū mɑ́ á kàm ā.
Où es-tu?,Ǒ mɑ̀ hɑ̄?
Je suis au travail.,Ngɑ̌ mɑ̀ mfɑ̀'.
Je suis à la cuisine.,Ngɑ̌ mɑ̀ ndʉ̄ɑ̀lə̄ə̄.
Je suis chez mon ami(e).,Ngɑ̌(mɑ̀) wú sēn à.
Que fais-tu?,Ǒ mɑ̀ngʉ́ kɑ́?
J'étudie mes leçons.,Ngɑ̌ mɑ̀nzhī'sī wū.
Je suis occupé(e),Ngɑ̌ cáhsí.
Je travaille.,Ngɑ̌ mɑ̀mfɑ́'.
Où vas-tu?,Ǒ mɑ̀ngén mɑ̀ hɑ̄? Ǒ ngén mɑ̀ hɑ̄?
Je vais à(au) …,Ngɑ̌(mɑ̀)ngén mɑ̀ …
Je vais à l'école.,Ngɑ̌(mɑ̀)ngén mɑ̀ zʉ̌'ŋwɑ̀'nì.
Je vais au travail.,Ngɑ̌(mɑ̀)ngén mɑ̀ mfɑ̀'.
Je vais au champ.,Ngɑ̌(mɑ̀)ngén mɑ̀ kò.
Je vais chez …,Ngɑ̌(mɑ̀)ngén mɑ̀ wú …
Je vais chez mon ami.,Ngɑ̌(mɑ̀)ngén mɑ̀ wú sēn à.
Je m'en vais chez la coiffeuse.,Ngɑ̌(mɑ̀)ngén mɑ̀ wú nkwâtū/mbɑ̂'tū.
Je m'en vais chez le coiffeur.,Ngɑ̌(mɑ̀)ngén mɑ̀ wú nkōòtū.
Que vas-tu faire là-bas? Pour quelle raison y vas-tu?,Ǒ mɑ̀ngén mʉ̀ nǔkɑ́? Ǒ ngén mʉ̌ ɑ́ ghʉ̌ kɑ́?
Je vais me faire tresser les cheveux.,Ngɑ̌(mɑ̀)ngén kwāt/pɑ̄' tū ā.
Je vais me raser la tête.,Ngɑ̌(mɑ̀)ngén kōō tū ā.
Je vais lui rendre visite.,Ngɑ̌(mɑ̀)ngén yə̀'/ywè' ī.
Je vais le saluer.,Ngɑ̌(mɑ̀)ngén cɑ̀'sì ī.
Vas-tu y rester longtemps?,Ǒ ìnsī mʉ̀ tɑ̀' ɑ́?
"Non, je ne vais pas y rester longtemps.","Ngǎ', ǹ sī ìnsī mʉ̀ yə̄ə̄ bɑ̄."
Où as-tu entendu cela?,Ǒ yú' yāā mɑ̀ hɑ̄?
J'ai entendu ça au marché.,Ngɑ̌ yú' yāā mɑ̀ ntēē.
